created_utc,domain,is_robot_indexable,selftext,subreddit,title,post_hint
1668044382,self.DogAdvice,True,"Cross-posted to r/vet but looking for some level-headed advice from other dog parents. 

7 year old lab mix with propensity to eat things she should not (but always passes them)

55lbs, spayed. Takes 16mg apoquel daily. 

On Sunday, she was in her kennel and must have gnawed off part of her fleece blanket. We noticed this in her stool the next day. While she hasn't eaten this before, she's taken a stab at a kennel cover, a back pack, a passport, and various other inedibles over the years without issue. 

She's eating, drinking, and behaving normally. We don't see any fleece after Monday night. Stomach is soft, she doesn't seem to have any pain.

This morning, I wake up to find her pooping in our bed. Normal stool (not diarrhea) but unusual. I think it might be an anxiety poop since her schedule is off and we have been packing for a cross country move. She has pooped inside because of anxiety before. 

I take her to a 24 hour vet out of an abundance of caution, and because I'm nervous about any issues during move. 

they take x-rays, but overall she looks fine according to the vet. Says her belly is soft. We get sent home with antibiotics and a probiotic for any digestive upset. 

This evening, they call and say they sent the x-rays to a radiologist who identified something in her stomach that ""likely"" is the blanket. They recommend surgery or at least observation in their ICU, fasting, and rescan tomorrow. I ask if we can just fast her overnight and bring her back, vet doesn't like that plan. I ask if we can get her scans from this morning and talk to our normal vet tomorrow for a second opinion. She says she doesn't know if they can send the scans and the radiologist was a second opinion. Idk if she was frustrated but she seemed to really dislike that I asked.

I'm at a loss here, I have whiplash from the ""yeah she's fine"" to ""no she needs surgery."" Am I making a massive mistake by waiting to see her normal vet tomorrow? She has separation anxiety and I feel like an overnight is also overkill when she is behaving like her happy, normal self.

The complicating factor  were supposed to leave for our move on Friday. It's a three day trip, and we will be pretty far from emergency care Saturday afternoon through Sunday afternoon when we arrive. I will push it back and pay for a hotel to stay with her if she needs surgery but I feel like I'm not getting a good picture of the situation when there was this massive switch.

She's pooped, ate, drank, and played all day. 

Edit to clarify, vet definitely said it was in her stomach not intestines. I wouldn't play around with her intestines.",DogAdvice,Dog heath decision - what would you do?,
1668042162,self.DogAdvice,True,"I have an almost 2 year old corgi/jack Russell mix. My bf and I want to start bringing him to his house to get him used to everything but the night he stayed was very frustrating. Usually, he’s fine in his crate. Doesn’t whine or bark. He goes outside by himself and is fully house trained. When I brought him over I thought I would just have to worry about the cats being around him (he grew up around cats). When I brought him in we fed him in his crate (as usual) and he kept whining and barking. I thought it was bc he wanted to see me but even then he kept barking. We let him roam the house and the cats watched in a safe location. He was fine out of the crate. If I let him out in the yard, he would cry and scratch the door if by himself and if I went out with him he wouldn’t potty and once, he even peed the second we walked back in the door. It was just not a good evening for us. I just need advice on what I could do better.",DogAdvice,How to introduce my dog into my bfs house.,
1668041331,self.DogAdvice,True,"So I've asked before on here pretty sure and I've emailed our local humane society for advice from their behaviorist, but I'm not having any luck. 


My sister has a small chiweenie  that was a rescue from a hoarder situation, she's 9 years old now, we've had her little over a year.  She was clearly abused given by all the scars on her face, she used to bark and run away from everything but now its escalated to barking and charging at stuff to bite it- atleast for me and my dogs. 

A few months ago when I first asked for advice it happened after she bit me for the first time. Had to get stitches but I blame myself because I could've handled the situation better. Long story short sister left the house, dog somehow got foot stuck in spiral notebook, tried to help dog and she was letting me until I got pliers then- chomped.  She was scared amd hurt so really dont blame her.

After that I tried really  hard to get her to like me like she's super food motivated so I give her treats and bought her lickimatts and treat toys to help her destress.  For awhile it did seem like she was really coming around to me, like she would come up to me at the gate wagging her tail expecting a treat and isn't as upset when my sister isn't home. 

But she's suddenly made a U-turn to being mean again. My sister let her out of her room and she charged at me barking tried to grab my leg but thankfully just grabbed my pants legs. She's tried that a couple times now and my sister ignores me and tells me it's no big deal.

Now when I come over to the doggy gate at my sisters door she runs up to the gate barking, snarling, and trying to get at me through the gate. Literally yesterday I put a basket of clothing  by the gate and she grabbed a sweater sleeve through the gate and started biting the hell out of it. 

I don't know what to do honestly,  I've done what I can safely and my sister doesn't seem to care or see a big deal about the behavior. I've told her that she needs to start walking the dog or burn off some of that energy to help with stress and don't use negative reinforcement bc she's already afraid(ie spray bottle and yelling) at bare minimum. Neither suggestions have been used. 


I make sure to keep her separate from my dogs per adviced by the behaviorist, I'm pretty sure she'd start a fight with my dogs and that would likely end poorly since my dogs are 75 lbs and 50 lbs. 

Honestly I'm stumped at what to do at this point. The way things are going I'm defiantly going to get bit again and I'd feel really guilty because if that happens the next step will likely be euthanasia.",DogAdvice,aggressive dog just keeps getting worse,
1668041173,i.redd.it,True,,DogAdvice,Labrador mixed with what? He's 85pds and tall with huge feet!,image
1668040538,i.redd.it,True,,DogAdvice,my 6 year old dog has this under his belly he constantly licks it but it doesn’t seem to be painful to him does anyone have any idea as to what it could be?,image
1668039655,i.redd.it,True,,DogAdvice,"My dog was stolen from my backyard last weekend and ended up in the pound until Wednesday. He had a collar and harness on but they just gave him back with this horrible leash, that’s been irritating is throat. Any solutions until I can afford to buy him new stuff",image
1668038336,i.redd.it,True,,DogAdvice,Help! Ear Infection gone wild. Male 40lb lab mix is taking 10mg prednisone and is using a TruzUltra/Keto/Baytril ear flush. This is day 2 of meds. Do I try to clean out the gunk? He won’t let me near his ear and I can see a swollen patch at the bottom of his ear…,image
1668037921,/r/DogAdvice/comments/yqzjag/heres_some_puppy_asmr_of_my_dog_chewing_a_sock/,True,,DogAdvice,Here’s some puppy ASMR of my dog chewing a sock anyone know why it sounds so crunchy while he’s chewing?,hosted:video
1668037818,self.DogAdvice,True,"We went to the vet a few months ago for a suspected uti. Urinalysis found suspected bacteria but the urine culture ultimately found no bacteria. So the vet said it was probably not a uti. During this visit we also did a blood test but everything was normal except high bilirubin. 

Today we went back to the vet to do another blood test and it’s different doctor this time (but the same clinic) who is going over the last visit. He mentions something the other vet didn’t which is my dogs urine is highly acidic. A pH of 9 which could indicate a uti. 

Could someone explain some of the reasons why it would be so high? One of the reason is probably due to her not drinking enough water. She really does not even though it is available. Also is there ways to lower her pH?",DogAdvice,Lowering dog’s urine pH?,
1668037804,self.DogAdvice,True,My male German Shepherd turned 2 this week so we bought him any toy he picked out at the store. He previously showed some protective behavior towards stuffed toys so we stayed away from them and pretty much stick to rubber toys. We've had him for a year now and he's completed his training classes but still showed some protective behavior toward stuffed plush toys (but none towards his bones and rubber toys or even food). Of course he picked a plush duck toy and still showed some protective behavior over it (growling and snipping that otherwise we never see). Well the toy lasted all of 2 days but I'm wondering if we should continue to avoid plush toys or if it would be beneficial to keep buying them to hopefully wean out the protective behavior with treat exchanges or something. He's a very sweet friendly guy and never shows aggression except when protecting his plush toys.,DogAdvice,Plush toy aggression,
1668036619,self.DogAdvice,True,"Hello. I’m looking for advice on fleas. I have a cat and a dog. I live in an apartment. We have been through every flea medicine except a few and we cant do the flea bombs because we have no where to put them that is safe for that long. This has been on going more than a year. We are a younger couple with one child who moved out for the first time right before the pandemic. Ive lost jobs cars and more. These pets need help. Im doing food delivery constantly just to provide food and try to cover bills. We are doing okay finally but these guys need me to do this. Im asking what else to try because the last medicine we haven’t tried is around 120 dollars and thats just for our dog. If it doesn’t work which i dont think it will because these fleas are in the carpets and furniture. And we cant remove them because we cant afford to pay for that much garbage to be taken. The carpet isn’t stapled in they are rugs and hardwood. I vacuum daily and do wash. Ive read every article. Im doing everything i can on a doordashers wage. You can judge me if you want but if you knew what we have been through i the past 5 years you would say wow you are doing so well. And thanks, i know. But seriously, i cant even call the vet because they said they need to be treated  for 3 months and they cant be seen with fleas still on them. Ive even covered this place and pets in that tan powered that starts with a D and nothing.",DogAdvice,Flea disaster,
1668036379,self.DogAdvice,True,"My puppy is a year old this month. He’s almost completely housebroken. During the day he will only have an accidental poop in the house if it’s right after a meal and he’s not immediately let out after. Lesson learned and problem solved. 
The problem I haven’t been able to fix happens in the middle of the night. He sleeps with me, always has. When he was very small I would set alarms to get up a couple times a night to take him out. That went to once a night, and eventually after a few months i stopped setting alarms. This worked for both of my older dogs, they never have accidents. 
Sometimes my puppy holds it, but most night he gets up at some point and has a poop and pee.  I have concrete floors, so it’s not the end of the world. I never make a fuss, I just don’t know how to get him to figure it out. Do I need to go back to setting an alarm every night for a while, maybe move the alarm time progressively longer to get him to hold it till morning? 
Any advice is welcome thanks!",DogAdvice,Potty training problem,
1668034876,self.DogAdvice,True,"My dog has been going through a myriad of health issues. Recently, she has stopped eating dry dog food or drinking from her water bowl. I thought maybe she was just eating slowly, or just didn't want to be outside in the cold. However, she will eat wet dog food. I'm working on getting her to the vet, but in the meantime, I need a way to feed her that isn't super expensive. How can I feed her for a reasonable price? Because I cannot afford $50/week.",DogAdvice,Dog Won't Eat Dry Dog Food- How to Feed,
1668034799,self.DogAdvice,True,my dog is sick and won’t eat so i basically need to force feed him but he is now aggressive. before he does not bite or show aggression not until he is confined at the vet clinic. any tips on how to get him eating by himself? or how can i force feed him without getting bitten? thank you very much,DogAdvice,force feeding,
1668033500,self.DogAdvice,True,My Frenchie has recently started gnawing at his paw and licking it sometimes his pads and paws are fine in general and no sign of infection/ something bad . Was wondering if this is common this time of year or of there is something to get him to stop doing so any advice helps cheers.,DogAdvice,Frenchie paw gnawing,
1668032673,self.DogAdvice,True,"I need advice!

I have an 8 year old Rat Terrier mix. She’s got a lot of health problems and her vet bills are getting really expensive. She’s got heart disease and can’t be under stress. 

I have a one year old Tortie cat named Clover. I’ve had her a little over a year. She really stresses my dog out. She’ll go and hit my dog all the time. There are times where she’s got Sadie’s eye and made her squint. (She’s not declawed). Sometimes when Sadie is laying down or something, Cloverr will come and start hitting Sadie and Sadie gets mad and starts going after her and I’m afraid that Sadie might hurt her because she’s constantly bothering my dog and my dog is getting really stressed. Like I mentioned above, my dog’s vet bills are getting expensive. I’m 3k in debt. I don’t know if I can even afford clovers vet bills. I’ve had my dog when I was going through drug addiction and she saved my life. So my dog will not go. However, I was wondering if it’s better for both of them if I rehome Clover to someone who can afford her and give her more attention and maybe she’ll even have some cat friends in a new home. 

What would you do? I’m so lost. I love Clover but I have to do what’s best for my dog and Clover both.",DogAdvice,Should I rehome my cat?,
1668031451,/r/DogAdvice/comments/yqwzbc/is_this_puberty_stress_response_the_vet_seems/,True,,DogAdvice,Is this puberty? Stress response? The vet seems unconcerned but I’m very concerned. More info in comments.,hosted:video
1668031202,self.DogAdvice,True,"I have a one year old Jack Russeler Fox Terrier Mix. Since I got her around the pandemic and was told to keep her away from other dogs without her vaccines (which took around 6 months), she us very stranger wary.

Apparently when I’m not around, she doesn’t bark at noises and at doggy spas, she’s really well-behaved but when I’m around and sitting down, she barks at any noise outside and at anyone who gets close to me (even my father. She’s even fine on walks and even approaches strangers to sniff them.

Is there any tips on what I can try to do to fix this behavior? I want for her to be with me at my dad’s convenience store that’s opening up in a few months but with the way she acts, that seems like it’ll be impossible.",DogAdvice,Help with dog whose overprotective and barks at anyone who approaches me when I’m sitting down/sounds outside,
1668028795,i.redd.it,True,,DogAdvice,anyone know what this is?,image
1668027293,self.DogAdvice,True,Does anyone know if there’s something special about the Hills Science Diet Sensitive Stomach dog food[https://www.hillspet.com/dog-food/sd-canine-adult-sensitive-stomach-and-skin-dry](https://www.hillspet.com/dog-food/sd-canine-adult-sensitive-stomach-and-skin-dry)? A few picky dogs I know (including my two puppies 18 months and 2 months both enjoy this kibble). They didn’t seem to like the Hills Science Chicken and Barley regular recipe though. [https://www.hillspet.com/dog-food/sd-canine-puppy-dry](https://www.hillspet.com/dog-food/sd-canine-puppy-dry),DogAdvice,Hill Science Diet Dry Kibble,self
1668026000,self.DogAdvice,True,"So I adore my dog. He's an ""American"" Corgi. I knew he was a corgi mix when I got him. But I didn't really know about the fashion breed until after. I have a full Pembroke. Anyway, I got him when he was about nine months old. So he wasn't a puppy. The story is that he was the last of a litter. No one wanted him because he wasn't real heavy with the red merle that they wanted. And he didn't get the blue eyes. So he was kind of cast aside. The breeder ended up moving and couldn't sell him so her mom took him. And she breeds American Bulldogs. My little guy was kept mostly in a kennel that was heated and cooled, according to the seller. She said he got plenty of time hanging out with the other dogs. But I have no clue what happened as far as training goes. She said he was in the process of potty training.

I've had him now for three years. I finished his training. So he does awesome on leashes. He's potty trained. Does really well with other dogs. And cats. Like amazing with cats. Good dog. Super smart. Learned really fast. BUT during the first year I noticed some odd behavior. One, he was scared of males at first. To the point when my boyfriend would pet him, he'd pee. Second, showing any kind of discipline would also make him pee. He'd flinch if he thought he was in trouble. He'd pee if we raised our voice. So of course I'm assuming he was abused.

A lot of the behavior we've corrected with patience and consistency. He started getting food aggressive but we've corrected that. He's still really bad about getting into the trash. But here's the thing... so let me first say he trained *himself* to go into the kennel. Like... he realized when we leave, we put him in the kennel. So when we put our shoes on, that's where he goes. I'm again assuming this is a save haven for him. So any time he thinks he's in trouble, he also puts himself in the kennel. It got to the point where now we don't really know how to punish him. Because now he growls at us when he gets in trouble. 

His body language is more like he's scared. We've NEVER hit him. We do not believe in physically correcting our dogs. Just... no. But he definitely backs himself into the kennel and growls when we get onto him. He's bitten me once. He got a pork chop the cat had knocked down. And I reached for it thinking I could grab it. Big mistake on my part. I didn't say anything, I just moved really fast and he snapped at me. I should have known because at that point I was aware of how scared he gets. Because usually, I'll tell him drop it and I can grab what he's got. 

He's not protective of the kennel. I can reach in there just fine. I can reach in there when he's in there. I try not to reach around him when he's eating. I feel like he gets really uptight when he eats. I can move the bowl slowly, though. So I don't know if the food aggression is linked to the kennel thing. I don't know if the abuse is just that deeply rooted. My boyfriend and I have been playing around with different ideas. Like putting a blanket of the kennel when he's in trouble? Or leaving the kennel shut until we need to let him in there. I don't know. 

What I do know is that if something works, he'll pick it up. He's seriously the smartest thing. I just don't understand why he still gets scared and why he flinches. He's been with us for three years, now, and we've never hit him. I don't know why he's so scared. I'm really looking for ways to kind of correct this behavior so he can know better when he's in trouble. It's like he thinks because he's punishing himself, he can get away with it.",DogAdvice,Correcting Aggressive Behavior,
1668021952,i.redd.it,True,,DogAdvice,"This is Henry, an 8 month old chihuahua/rat terrier mix. He likes to use that long snout of his to sniff around in our lawn for wild rabbit pellets. How do I get him to stop? More in the comments.",image
1668021074,/r/DogAdvice/comments/yqsemu/dog_has_been_jerking_head_when_looking_up_for/,True,,DogAdvice,Dog has been jerking head when looking up for past couple weeks. Seems involuntary?,hosted:video
1668019167,i.redd.it,True,,DogAdvice,Help dog losing fur and itching what does this look like?,image
1668016996,i.redd.it,True,,DogAdvice,Who cares about the dogs’ health when it makes me smile…,image
1668008353,self.DogAdvice,True,"I have a 9 year old mutt, Blu (medium sized, \~30lbs, I was told he is part basset, part blue heeler) that I got when I was a teenager and still living with my mom.  When I moved out of my mom's house, I didn't take him with me because my mom's house had a large yard and I was moving into an apartment, so I didn't think it would be fair to him.  Almost 2 years ago, my mom's house burned down, and my husband and I had recently gotten an apartment with a yard so I took him in.  When my mom's house was rebuilt, the fenced off yard was significantly smaller.  My mom already has 2 dogs, and she is not the best dog owner.  She doesn't train them or even correct their bad behavior, and she rarely lets them out of her room.  2 months ago, I had to ask my mom to watch Blu for a couple weeks while we were living with a friend and waiting to move in to a house.  The yard at our house is large and would be perfect for Blu, but there are neighborhood deer that frequently come around, and Blu has a past of chasing wildlife (chickens, guineas, and peacocks that are no longer around at my mom's).  The yard is fenced in, but I wouldn't put it past him to jump right over it if he wanted to.  I haven't brought him to our house yet, because I'm worried he'll chase the deer, but leaving him with my mom with so little space makes me feel immense guilt.  He is getting older, and I want him to spend his last years with as much room to play as we can give him, but I'm so worried about what would happen if he attacked a deer.  This has caused a few small arguments between my husband and I because he thinks its a bad idea to bring Blu around the deer, and while I agree it could be a problem, I feel like I'm abandoning my dog.  

Any advice on what to do in this situation would be appreciated.  

TIA!",DogAdvice,Should I Take My Dog Back From My Mom?,
1668007897,i.redd.it,True,,DogAdvice,Update on Cody. Has the little red cut on his back. Vet says to just try to keep him from licking it. Thanks to everyone who helped me figure out what to do! 🙏,image
1668007764,self.DogAdvice,True,I was cooking with a non stick pan when it started smoking. The house quickly got hazey so I opened windows and turned on the stove fan. My dog’s breathing is a bit shakey now. I took her outside but I’m concerned for her wellbeing. She’s acting normal otherwise and wanted to chase her ball when we came out. Should I be worried?,DogAdvice,teflon pan harmful to dogs?,
1668006350,self.DogAdvice,True,"I have a five year old female American Akita, who is very stubborn about eating. Anytime I give her breakfast or dinner she’ll stare up at me with sad eyes like “do I have to?” And just stare at her bowl for a long while before sniffing at it for a minute then finally she’ll eat. 
She has always enjoyed her food she has just gotten more stubborn in the past couple months. I haven’t changed her food, feeding times, or feeding arrangements (my 13 yr old min pin is fed separately as he’s food aggressive and takes medication). When her friend Koda visits (5 yr old mastiff/Akita) she eats perfectly fine, maybe the threat of her food being eaten? But my dog will also attempt to eat her food if he’s near and she behaves just as stubborn. I refuse to give her table scraps and I try to watch how many treats I distribute during the day, as well as not giving her any close to meal times but she still gives me the look. Is there anyway I can encourage her to eat better? Or should I just leave it as is since she’s still eating? I work at a doggy daycare that she goes with me to in the morning and her not eating before we leave can be a little frustrating. TIA",DogAdvice,Stubborn eater,
1668004995,self.DogAdvice,True,"We have a rescue pit (unknown maybe collie) mix with a nervous personality some attachment issues. We’ve had her for two years now and she’s sweet, smart, playful, and trust us but is weary of strangers. 

She in general doesn’t like change especially from set schedules so the first few days after the time change her being a little anxious was expected. But she is still waking up at 5 whining and yipping until one of us get her and let her into our room. That’s normally me and I’m getting sick of it.

She’s not sick, gets waked twice a day, food and water taken away after dinner, crate trained and likes sleeping in it, her room is dark and has fans for white noise. We’ve tried doggy mellow treats and they just wind her up more. 

Any tips or ideas other than exercising her more?

Crossposted to /dogs",DogAdvice,Dog anxious after time change waking up early,
1667998876,i.redd.it,True,,DogAdvice,"husky mix? the people we recently adopted this handsome boy from said they believe he's husky and collie, but I'm not seeing the collie! thoughts?",image
