created_utc,domain,is_robot_indexable,selftext,subreddit,title,post_hint
1669034602,self.DogAdvice,True,"TL;DR leave my dog at an Airbnb close by, doggie daycare, or leave him at home but he’ll be alone for longer periods of time. 


Christmas is coming up and I’m still trying to figure out what would be the best way to take care of my dog while at family gatherings. Will be going to one family function on Christmas Eve, and another on Christmas Day. They are both close to each other, but far enough from my house that we will likely be staying over at my mom’s house for the two days.



My dog is quite well behaved when visiting other people, but can’t go to the Christmas Eve gathering because they have cats, and he can’t come to the Christmas Day because my sister has pretty bad allergies and a small baby, and is also scared of Coop a bit (he’s very sweet but very big and very hairy). I could probably fight to bring him but I don’t want my sister to be uncomfortable at Christmas.



Anyway, I’m not really sure what I’m going to do with my dog. He is really good 99% of the time, but will sometimes steal something and resource guard it, so I don’t feel comfortable leaving him at a daycare. We once got a friend to watch him for a week while we were on vacation and he was so bad, that my friend was literally scared of him and we had to get a family member pick him up midweek. (Had a different friend watch him once but that friend I guess was experienced with resource guarding so was able to handle it). But it seems like he acts up when he’s with unfamiliar people in an unfamiliar place. He usually is watched by my partners family when we go away (he grew up with them in that house so they never have any trouble) but they are going to be at the Christmas Eve gathering, and will have their own thing on Christmas Day. 



My mom has offered to watch him while we are away for Christmas Eve, but then I’ll still need to find somewhere for him to go on Christmas Day. 



Options are: I have booked a dog friendly Airbnb near my mom’s house that we could bring him to so we can easily go and visit / walk him a few times that day. Im just worried he will be really stressed in an unfamiliar house by himself and destroy something (he’s hasn’t had separation anxiety at our house). 



Or we leave him at our place and just go home each night but Coop will be by himself for two full days and I don’t think that’s really fair for him. 



There are also “doggie suites” in my mom’s area, sort of like a daycare, but alone. But you have to do a consultation as well as a “doggie daycare trial”, so we’d have to get that done before the holidays start. 



Ideally, my mom’s friend lives practically next door and we could potentially leave Coop there (she has a dog as well so it’s all dog proofed), but only if she is away for Christmas because while our dogs do get along, it’s still always a risk with two dogs in the same house. But it would be so nice if we could use her house because we could pop in and out super easily throughout the day and my family loves a Christmas walk. 



Does anyone have any advice, or tips? All is appreciated !!",DogAdvice,What should I do about my dog over the holidays?,
1669030634,self.DogAdvice,True,"Yelp of pain coupled with low and tentative mobility on Thursday, vet appointment on Friday couldn’t figure out what was wrong and we were sent home with anti inflammatory and pain meds. 
Went to emergency today as he was visibly distressed and vet immediately knew it was either a slipped or ruptured disc. Sent home with heavy pain meds and crating orders apart from toilet break every 4ish hours. 
If no improvement in 2-3 days he needs to have spinal surgery. 
I’m so scared, worried, paranoid and an emotional wreck. Has anyone been in a similar situation? Any happy stories? Please.",DogAdvice,Slipped or possible ruptured disc,
1669027911,self.DogAdvice,True,"So let’s start this post off by saying I haven’t had her the whole time and was born during quarentine so had never left the house, so definitely had no idea how to even attempt swimming or what a beach was, but needless to say I was in the pool one day with said dog and carrying her to the edge just to test if she knew anything about swimming (which she didn’t, but was close to steps so it didn’t matter) and I let her go but was right next to her and she was moving her front legs but not back, and just ended up sinking, so any advice on how to help her how to swim?",DogAdvice,My dog (11 months old) cannot swim,
1669026177,self.DogAdvice,True,"Last night around 1:30am, my friend and I found a pup wandering around outside, freezing cold, without a collar. We got her inside, fed and watered, a nice warm bath, and lots of pets and attention. She’s curled up, sleeping cozily now. 

I’ve never had a dog before… the largest animal I’ve had is a cat… and I don’t want to mess things up. So… help? 

I plan to take her to the vet tomorrow for a check up, and to see if she has one of those scanner ID chips implanted. If not, I’ll post flyers around my neighborhood to see if anyone is missing her. 

She was terrified, starving, and smelled like stale urine when we found her. And she’s got a kind of rust-colored rash under her neck where a collar should’ve been. She hasn’t really made any noise, and is incredibly sweet. She stopped shaking from fear after the bath, and even managed to have some playful tippy taps when she met my cat (who is not amused). 

No idea what breed she is… see the Imgur album below. 

Thank you for any help you lovely folks are willing to provide! 

https://imgur.com/a/4rLcS2I",DogAdvice,"Found a freezing pup outside, now what?",self
1669024549,i.redd.it,True,"Hi! A few months ago I had my dog groomed, and noticed she was then scratching a bit more often, I attributed this to the shampoo, and did some treatments as she has dry skin. She got wrapped up in my shirt a few nights ago, so I started looking at her back in an attempt to detangle her, and noticed this tiny bald spot forming. She’s not scratching the affected area, but she is licking it. Behavior is normal otherwise with no issues eating or drinking. Is there anything I can do to provide her some relief and prevent her from licking the area and irritating it further?",DogAdvice,9 year old pomchi now has a bald spot,image
1669019254,i.redd.it,True,,DogAdvice,"Dog paw lump from litel and white to big and red. Vet appointment scheduled, what might it be?",image
1669018202,self.DogAdvice,True,"We brought a puppy home during the first week of November. She's a Shih Tzu who came from a kennel, before being brought to the province where we went to get her. We decided to bring our 5 y/o dog (who's a Shih Tzu too) so they can meet at a neutral place. 

At home, the puppy often bumps into our Shih Tzu, runs towards her, and signals that she wants to play. Our Shih Tzu always runs away and asks my mom to carry her away from the puppy. Sometimes she goes up to my parents' room and hides just so the puppy won't find her. Do you have any tips on how they can get along better and how we can get our Shih Tzu to warm up to the puppy?",DogAdvice,Introducing new puppy (4 mos) to my dog (5 y/o),
1669017562,i.redd.it,True,,DogAdvice,"I got this from the Livestock section of my pet supply store. Biggest recommendation for a boofy doofus. It tastes bad so no licking and it is antiseptic so we don't need to worry about running to te vet over every minor cut or scratch. She does not like it, but accepts in exchange for chicken feet.",image
1669015664,self.DogAdvice,True,"I recently adopted a dog. She’s a 4 year old boxer, bulldog mix and she’s just the sweetest dog on the planet and she’s already so comfortable in my home. She showed absolutely no signs of abuse until today. My boyfriend found a switch blade earlier that day. We we’re standing in the kitchen while he was cleaning and fixing the faulty button that would release the blade. He got it working and the blade popped out. This poor dog went from laying contently on the ground to staring and the blade. She sat and looked at it for a minute before getting up, peeing herself, then hiding behind the table. She was still staring at us while I took the knife and threw it away. I went to get paper towels to clean the pee and when I turned she had her tail tucked, licking the urine. Of course she didn’t get in trouble for doing this. I kept saying in a gentle voice “what’s wrong?” so she didn’t feel like she did something bad. She is fully house broken and has always scratched at the door when she needs to go out. I had my boyfriend lead her to another room while I cleaned so she didn’t lick it anymore. This was extremely heart breaking to see. She’s such a sweet gentle dog. It there anything I can do to help heal this poor babies traumatic past?",DogAdvice,Doggie therapy?,
1669010516,self.DogAdvice,True,"i dog sit at my home every now and then as a side hustle. i’ve recently started because i just moved into a home with a fenced in backyard. i have pet sitting insurance that i recently acquired as well. 
i’m watching my friends 2 dogs, 1 of which has known my dog for many years and they have played together a few times in the past. she asked me to watch her dogs while she goes out of town for holiday. 
earlier, i was supervising them in the backyard. they all have a similar energy level and play pretty rough. they were rolling around on top of each other, and suddenly one is bleeding profusely and i can’t tell from where. nothing malicious happened at all. turns out, the tip of the one dogs ear was cut, maybe from a nail or a tooth that was flailing around (like i said there was no malicious chomping action). dog ears are all veins and capillaries so the bleeding is intense and never ending. at first when i cleaned her up it was just a little nick, not even a CM long. she continued to fuss with it and shake her head every time i tried to clean it, thus opening it more, and eventually splitting it. i bought things to slow the bleeding and wrap it up, and put a cone on her. i’m taking her to the vet first thing in the morning and it’s going to cost me around $300. she’s not in any pain, seemingly, but i feel terrible. this has never happened before and it was a freak accident. i have kept the owner informed and she isn’t upset with me at all, she knows her dogs play rough and she mentioned she was surprised they hadn’t hurt each other before. 
is there anything i’m missing here that i need to do? will my pet sitting insurance reimburse me for the vet fees?",DogAdvice,a doggie got hurt,
1669003302,self.DogAdvice,True,Im taking her to the vet tomorrow but my mom is freaking out. Is there anything else I should do,DogAdvice,Dog at 3 chocholate chip cookies,
1669000374,self.DogAdvice,True,"
We have a four year old Shiba Inu named Chai. We have had him since he was 8 weeks old, and he is generally a very good boy. Of course, being a shiba, he has his ‘quirks,’ but when it comes to training and behavior, he has been a very good boy for four years now. 

He has also usually shown to be very adaptable. We have moved a couple of times since we got him, and he has also adapted through a lot of job/routine changing. He has always readjusted extremely quickly and well, honestly he’s really a trooper. 

But, out of nowhere ( for him ), he’s starting to act out. I’d like to ask you all to keep open and understanding minds as you read this! And know that I have years of experience with dog owning and training, and I know ‘objective’ solutions for some of the issues we’re having — im just a little stressed and overwhelmed and wondering if anyone has any constructive insight!

We recently moved again, about two months ago now. And in fact, the place we moved into provides a much nicer situation for Chai. And as he usually does, he adjusted very very quickly to the new place! He was doing amazing. 

Until I started my new job, about three weeks ago. Before this, I worked a full time job, and Chai was very used to being in a crate when I was at work — my new job is no different. 

But since the very first night after starting my new job, Chai has been whining in his crate. He has /never/, truly never, done that before. Not even a couple years ago when our life was extremely unstable and we had almost no routine. Now, we are stable, and we do have routine — but Chai seems to have almost regressed? 

Since my fiancé is at home most of the time, Chai pretty much only has to be crated at night. I wait until the last possible minute before I go to bed to put him in there, giving him as much time outside of the crate as I can. He usually doesn’t go to bed til at least 1 am. I’ll even stay up later than I should just for his sake, since he suddenly hates being in there so much. He whines immediately when he goes in, and goes on for about an hour or so. And then, he whines again at like five in the morning, and continues to do so off and on until I get up. 

I’ve tried getting up to let him go potty, and then locking him back up, and he’ll keep whining, so I know that isn’t the problem. 

And again, this only started when I started working again. For the first month in the new house, he didn’t make a peep in his crate, no fuss whatsoever — which is his normal. But now he’s not only keeping himself awake with the whining, but he’s disturbing our sleep too, and I work a very mentally and physically exhausting job — needless to say, I’m definitely getting frustrated and confused. And very tired lol. 

Today, he has absolutely blown my mind with a new ‘regression.’ We use the Place command for him for when we aren’t able to supervise him — if one of us is nearby and can keep sort of an eye on him, he does as he pleases. But when we’re preoccupied and in a different part of the house, we put him on Place. Just like with his crate, he has always been an extremely good boy for years about this. He has always seemed to even enjoy the routine, he gets excited to go on Place and he loves to curl up and snooze. 

But today, he has broken Place /four/ times in a row. The first time I wrote off as a fluke, thought maybe he needed to pee, but I still put him back on Place and released him myself, let him outside for a while, and then put him back. 

A few minutes later, I heard the clicking of his claws on the floor, and I was a little flabbergasted. He really /never/ does this. I put him back on Place. 

This has happened two more times. He doesn’t seem to be attempting to do anything specific when he gets up, like he isn’t going to the door to get out, he isn’t sniffing around the kitchen like he does when he’s hungry. He’s just trotting around or lying on the couch or something aimless. 

I know I’ve rambled on, and I know, being a dog group, people will have some most likely strong, owner-attacking opinions 💚 ( I’ve worked with dogs and dog people for over ten years, and I know how dog people are — especially on the internet! ) I just ask, again, that you guys try to understand that I know my dog, I know how to work with dogs, and I know logical solutions to these problems. I’m just struggling to understand where they’re coming from. I have never ever expected a ‘perfect’ dog, there’s no such thing, and I’ve always been very understanding of the misbehaviors he has normally has throughout his life. But these new things, his very sudden crate training and place training regressions, are important things and they’re very tiring. If this were a new dog, or a dog I didn’t know, or a dog who I know has had bad experiences with these things ( etc ), it would make a lot more sense to me. But Chai has only ever known crate and place training, and if anything, those two routines have been the more consistently stable things that he knows!",DogAdvice,Four year old dog suddenly acting out?,
1668998964,self.AskVet,True,,DogAdvice,"Painful back paws, Shiba Inu",
1668997239,self.DogAdvice,True,,DogAdvice,Looking for the best dogs suited for an apartment! Thank you,
1668996443,tiktok.com,True,,DogAdvice,I have a 12 year old diabetic pug and just need any help moving forward for his health and well being. Anything i can research or any advice is welcomed. Ive had him since he was born. I just want the rest of his days as comfortable as possible. #doglove #veterinarian #vet #foryoupage,rich:video
1668993276,i.redd.it,True,,DogAdvice,What is this skin affliction? 13 y/o shitzu,image
1668992671,i.redd.it,True,"- epsom salt soaking doesn’t work
- limps, but still able to walk",DogAdvice,Cyst on paw? Advice.,image
1668992338,i.redd.it,True,,DogAdvice,Weimaraner foot problem,image
1668992176,self.DogAdvice,True,"Hi guys. I have a puppy who when she was little 2-3 months would eat like her life depends on it and now at 7 months I have to beg and barter for her to finish even a quarter of her daily serving size. She’s been to the vet regularly and she’s fine, just uninterested. Does it just taste bad? Am I spoiling her too much?",DogAdvice,Puppy won’t eat,
1668991971,self.DogAdvice,True,"This is Mabel. We agreed to foster her a week ago (our third dog, first time fostering). We think she was born on the streets, pregnant and delivered puppies a couple of months ago. LOVES people and other dogs. All good.

But she is extremely needy. Likes to jump on us to get attention. Regardless of what we're doing at the moment. She also playfully nips at our feet, shoes and sometimes arms. She's intense. 

The trainer suggested this wire pen and it's been pretty useful. The idea is to keep her settled in one place during times we can't play with her. She goes in willingly but whines once whatever treat we lured her in with is finished.

I feel for her and care for her, but she's EXHAUSTING. Hoping we eventually alter her behavior enough so that either we can keep her or get her placed in a loving home.",DogAdvice,Just need to vent,
1668990736,i.redd.it,True,,DogAdvice,Is it normal for a groomer to buzz the hair off the testicles? This was only my second time going to the groomer and they didn’t do this last time. They buzzed so close they look raw. Is this ok or am I right to be upset?,image
1668990662,self.DogAdvice,True,"we have had my rottweiler(rocky) for around 4 and a half years now and recently my little sister was born. ever since shes been in the house he hasnt taken to her at all, he always barks at her bares his teeth to her, marks on all her stuff and sometimes nips her hands when she gets too close and he even steals her food but he doesnt do that to anyone else. but today he really bit her, she was playing with her toys near the gate which he was on the other side of and one of her toys fell through, and when she tried to get it back he bit at her hand and her hand went all red and she was crying, i have never seen her cry like that unless she is seriously hurt. no skin was broken but she has never even touched him or harmed him in any way so i dont know why he would react this way, he is also rather aggressive to me sometimes when i have food in my hands and barks and growls when i am running around with my little sister and entertaining her. my mother refuses to even get him training even though he is so aggressive and untrained and i am sick of him biting me and my sister and barking every time the neighbours go out, sometimes he barks non stop all night when i have school in the morning and its starting to seriously get in ny nerves. please i just need some advice on what to do.",DogAdvice,dog being aggressive ever since little sister arrived.,
1668989772,self.DogAdvice,True,"I've only had experience with an extremely reactive dog so I want to make sure I'm not overkill for this pup. And learn the difference between ""eh this is a minor issue I shouldn't micromanage"" and ""this is a real issue that should be tackled proactively."" 

We go on solo walks all the time and I introduce her to other people and other dogs. She's a little nervous around dogs but LOVES people. But sometimes she'll see (not meet) one person and just decide she doesn't like them. She doesn't pull or lunge. Just a clear sort of ""stay away from me"" bark. But it's so rare. Not even once a day that I'm confused on how to handle it. It's not even the same look, race, gender or clothing that sets her off though they trend more towards elderly women. And not even the same person every time. I've kinda of just let it slide as far as training. I apologize and we'll move to the side to let that person go through. Dogs are beings too right? They're gonna just not like someone sometimes like I do. But because she locks onto that person she doesn't like, it spooks them a bit. She'll do her one warning barking and then as they walk past she'll bark a 2-3 time more if I don't redirect her. Again, no lunging or anything. I often use treats to break her attention. But is that the best option? Because I am unsure how I can decrease her random, yet infrequent reactivity and make her more comfortable.

Final thing is her ""confirmation"" barking. She's otherwise very quiet and I live in an apartment. She sleeps in the bed with me and when I give her the command to come up to the bed at night, she does a single loud bark and comes over. Like a ""okay I hear you."" or ""On my way!"" thing. I'm worried it may wake up the neighbor in the middle of the night. During the day she doesn't confirmation bark like that. I don't get it. What are your thoughts on handling that?",DogAdvice,Are these things I should develop a training plan for?,
1668989140,self.DogAdvice,True,"Two and a half year old female black lab ... phone call to her vet suggested an e-colar for a few days.

Bee sting, big bite, maybe?",DogAdvice,Bee sting? Spider bite?,
1668989016,i.redd.it,True,"Two and a half year old female black lab ... phone call to her vet suggested an e-colar for a few days.

Bee sting, maybe?",DogAdvice,Nee sting? Spider bite?,image
1668987673,/r/DogAdvice/comments/z0j68h/how_do_i_curve_this_behavior/,True,If anyone could help me curve this behavior I would really appreciate if anyone could help he charges on site but he is very friendly,DogAdvice,How do I curve this behavior,
1668987328,self.DogAdvice,True,My dog has been with us for 3 weeks he is super friendly twords people and other dogs when me or my girlfriend are around when someone walks by in the house he will charge at them and then when that person Sudues my dog he is able to pet him and he’s very friendly how do I get this behavior to stop he’s a great dog he also shakes when this happens so I know it’s a fear response,DogAdvice,Dog is weirdly aggressive,
1668986256,self.DogAdvice,True,"There is a very large family around the corner from my daughter’s house that got a large breed puppy about 6 months ago. From the day they brought the dog home, it has been locked alone in an outdoor enclosure. He/she is never taken out of this 6’x6’ enclosure. One side is chain link, and it is covered by a roof but still exposed to the elements due to the chain link side. 

My daughter and her GF tried speaking to the family there, but a language barrier prevented any meaningful dialogue, and they were eventually told to leave. They then called animal control, who came out and checked on the dog, and then told my daughter that because the dog had food, water, and shelter, and was not chained for extended periods of time that there was nothing they could do. 

I’ve walked past this poor animal while walking my daughter’s dog and it breaks my heart. He/she whines piteously and claws endlessly at the cement beneath the chain link gate. 

I have moved on to considering other options to liberate this dog. What is the right thing to do here, morally? The dog is well-fed and hydrated, it’s coat is clean and nails trimmed. However, mentally I am certain the dog is in unbearable anguish. It hurts me physically and I don’t know what to do. My daughter and her GF have started walking their dog in other parts of the neighborhood because passing this animal is too painful. 

What is the moral option here? How can I help this dog? We are in WA state if that helps.",DogAdvice,"Abused Dog, AC Won’t Help",
