created_utc,domain,is_robot_indexable,selftext,subreddit,title,post_hint
1669615692,self.DogAdvice,True,"So my family got a new puppy for some background context that’ll make all you dog owners probably face palm (this was not my decision to get a new dog) We own 2 cats and 1 dog the 2 cats don’t fuck with the puppy who’s name is Luna they might hiss if she tries playing with them but never attack her just basically telling Luna to go away. Now the other dog we have is Ivy. I was really young when we got her and you can tell this dog was unfortunately not raised good she puts her ears back and thinks your gonna hit her when you pet her and overall is very skittish of other people except me and my family. We used to have another dog Quincy and quite often the two would get into fights and eventually after one fight Quincy was hurt bad so bad we sadly had to put him down. I don’t blame Ivy she could’ve been raised a lot better where she wouldn’t be aggressive and any sane dog owner would not get a new dog after knowing the dog they have now got the previous dog killed. Just 2 days into having Luna, Ivy thought she was gonna take her bone and attacked her luckily I was right there and broke it up but Luna has a tiny tiny little mark from where Ivy literally had her jaws around her head. I told my mom this and i’m trying to get it through to her that Luna is a American terrier pit bull mixed with a bull (or atleast I think i’m not a dog person really so I don’t know breeds) So having this young puppy grow up where a dog is attacking her will have her grow up and be aggressive back to other dogs and even Ivy. She’s gonna be a big dog and I really don’t wanna see two big ass dogs go at it because it will most likely end very very bad. So now I really don’t know what to do it’s unfair to get rid of Ivy and it’s a little risky to try and raise Luna in this type of environment. so far i’ve kinda been the one to step up and train Luna to be a good dog as-well as giving Ivy attention and trying to get the two to bond it’s stressful I will say especially cause i can’t be around the two 24/7 and my mom thinks it’s perfectly fine to leave the two dogs in the house alone without putting Luna in a room to keep away from Ivy. I think after I get paid ill buy a crate to put her in for the time being till she’s older because when no one’s home and if Ivy attacks no one can break up that fight and Luna will grow up to view Ivy as dangerous and eventually start fighting back and a pitbull going up against a husky is not something I want to happen man. So overall any advice is really needed, is there a way I can retrain Ivy to be more confident and not skittish? and even have her be less aggressive to the puppy. Thank you.",DogAdvice,Dog aggressive to new puppy,
1669614240,self.DogAdvice,True,"Pretty self-explanatory title. I have a 9 mo old GSD and a 2.5 yr old bengal cross cat. My pup is obsessed with my cat. Not in like a stalking prey-drive way, but like an idolizing way. He adores her. Steals slippers and brings them to her as a gift lol. 

Now, my cat is a covid-cat and prior to getting my dog was an only fur-child. She's very possessive of me to say the least. There have been these instances that show my cat truly *loves* my dog, but she certainly doesn't *like* him. He is everything she hates – loud, smelly, hyper, and too close to me. 

My cat has grown more tolerant and lets him come near her but sometimes he gets too carried away poking her with his nose or jumping up towards where she is so she will hiss or growl. He gets more excited and keeps going so she'll start smacking him but he just doesn't leave her alone. The other day she managed to scratch his eye. He's ok but he very much has not learned anything. 

&amp;#x200B;

Some important points to add here: 

\- They are never left alone. If I or my roommate have to leave, my dog is in his crate. I don't suspect anything would happen but I don't want to find out

\- My dog's body language has never been threatening. It's playful and light and seems like he genuinely just wants to play

\- My cat doesn't instigate anything, she just is defensive. She'll be fine once he learns her boundaries (growling, hissing, hitting)",DogAdvice,How to get my german shepherd puppy to respect my cat's boundaries?,
1669613041,i.redd.it,True,,DogAdvice,is this just her belly button? never seen one before!,image
1669611982,i.redd.it,True,"I’ve been to the vet for it before but got no clear answer. They are scabs but also dark spots. So, thoughts?",DogAdvice,What could this be,image
1669611390,/r/DogAdvice/comments/z6n8v5/dog_wont_stop_licking_his_paw_is_this_normal_dog/,True,,DogAdvice,Dog won’t stop licking his paw! Is this normal dog behavior or is there something to be worried about? He doesn’t seem to be uncomfortable or in pain at all but it’s a new behavior.,hosted:video
1669609586,i.redd.it,True,,DogAdvice,What is this on my dog appeared today. Vet on weds,image
1669609153,/r/DogAdvice/comments/z6mijs/are_they_both_playing/,True,,DogAdvice,Are they both playing?,hosted:video
1669608843,self.DogAdvice,True,"My dog is 13 years old and has had a whole host of issues this past year. He has a grade 6 heart murmur. He has had a series of seizures and strokes over the last 9 months. He usually recovers within a day but the last one hit him hard and took over 2 weeks for him to get back to normal. 

We have him on seizure and heart medication but we have a new issue. Apparently he has dementia or sun downing. He barks none stop ALL NIGHT. From 5PM-1AM he will bark. We both barely get any sleep and of course it’s upsetting to see him “distressed”?

I’m at a point where I feel like I should put him to sleep but it seems crazy because he’s otherwise fine. He knows who I am, how to get around the house, where his food and water is etc… but it’s like he’s confused between day and night. 

Honestly the thought alone makes me incredibly sad. I just feel like in some way he’s miserable. I just feel completely helpless and very fucking sad. I don’t know what else to do?",DogAdvice,Difficult decision,
1669607014,i.redd.it,True,,DogAdvice,Could anyone help me identify what this spot is on my dog’s belly?,image
1669606865,i.redd.it,True,,DogAdvice,My pitbull just had puppies how long before they are ready to go to there homes,image
1669606761,i.redd.it,True,,DogAdvice,My sisters Pitbull just had puppy’s how long should we keep them before they can go to homes,image
1669605697,self.DogAdvice,True,"My dog is a 4 year old medium, mixed-breed. For the past two days, he seems to be experiencing bouts of what seems like anxiety. He will follow everyone in the house, under their legs, sit with them, in general, be stuck to them. This is out of the ordinary for him, he’s ( for the most part) an independent boi. 

He’s eating, going on walks, going to the bathroom normally, and seems to bounce back to himself randomly throughout the day (this can last a few minutes to a few hours). I’m not sure what’s going on, and I don’t know if I’m just overthinking things.",DogAdvice,On/Off Clinginess with dog?,
1669603452,self.DogAdvice,True,We bought a dog from a shelter and he never stopped being afraid of men and some women including my dad. He will let my dad pet him in certain circumstances but cant eat if my dads in the kitchen etc. What can we do to have him stop fearing my dad.,DogAdvice,Dog is scared of my dad for 2 years.,
1669600865,self.DogAdvice,True,"I am wondering if anyone has suggestions for good best quality covered dog beds out there. My dog loves to burrow and her old bed is needing an upgrade. Looking for any suggestions.

Bonus if it is memory foam and if it can be shipped to Canada. Thanks in advance!",DogAdvice,Looking for best quality covered dog bed,
1669595994,i.redd.it,True,,DogAdvice,"This is stuck to my dog, should i pull it i don't know what it is?",image
1669595142,self.DogAdvice,True,"So whats the deal with that?!?! I have every type of toy from balls to chewables to dog puzzles to WHATEVER!!!  i put treats in the toys, i play with her for at least 30 min to give her the want to play and slowly pass the ball off to her. SHE STOPS EVERYTHING AND LOOKS AT ME LIKE A BALL SLAVE, i know i need to play with her and i do but she just stops when she realises im not going to keep going anf gets heself worked up. SHE REFUSES TO DO ANYTHING WHILE IM NOT HOME, REFUSES!!!!!@!!!!!!!!!!!!!!!!!!. she would rather wait 9 hours (i get off before my girlfriend most of the time) and ill get nothing ill play with a  ball, frisbe, tug of rope, PLUSH TOYS O ALL THOSE THINGS AND THEN SOME. WHAT DOES SHE DO FOR THE 2 TO 4 HRS IM HOME. NOTHING!!!!!!!!!!!!!!!!!! Ive tried engage her for like hour and she coupdnt care.She will only play and do anything at all is when my girlfiend gets home at 8ish. BUT WAIT ITS 10 PM ? SHE WILL JUMP AND TOSS HER BALL OR TOY LIKE SHES OUTSIDE?????? SHE WILL JUMP AND TOSS THAT TOY ANF RUN AROUND THE APT LIKE A DOG PARK AFTER 10. HOW MANY TIMES HAVE I PLAYED WITH THIS DOG AFTER 9 NONE, NONE AT ALLL. LITERALLY NOT ONCE HAVE I DONE ANYTHING PAST 9 PM. whats the problem???  I know some dogs will not play by themselves. But this i think is NOT one of those dogs. Ill try to play with her before work, ill put the same toys in her kennel to get her to think thier hers, NOTHING!!!!!! anything i can do that im not doing, forgetting or just ignorant of??? Beacuse this is dumb and i feel like im going crazy",DogAdvice,My dog refuses to play by herself and knows how to .she just refuses,
1669593595,self.DogAdvice,True,"Hello, I have a 9 week old puppy (his first night with me tonight) he's a pomerian boy.

I've been watching him for the past few hours whilst he's been sleeping and he keeps waking up every few minutes to scratch, and then changing positions sometimes getting completely up to lay somewhere else.. it seems like the scratching is keeping him awake and that changing positions a lot will hopefully help, but it doesn't 

I'm worried puppy won't be able to get a good sleep? Should I be concerned or is this normal? Thanks",DogAdvice,9 week old puppy waking up from sleep itching,
1669590667,i.redd.it,True,,DogAdvice,Is this a skin tag on my dogs chin?,image
1669590541,self.DogAdvice,True,"When i'm home by myself and when my gf is home with me, the dog sometimes goes under there too. He's not scared and just wants to be there. Is it a shiba thing? I guess he feels safe there.",DogAdvice,why does my shiba inu hide under our bed most of the day?,
1669586213,self.DogAdvice,True,"Just curious what you guys would have done. Nothing bad happen juste a little stressful experience. 

 I was arriving at an open parks where dog are allowed on leash.  An unleashed dog arrived to great my dog their owners 100/200 meters behind. I trust my dog recall a good amount and I know you don't mix leashed and unleashed dog so I let go of the leash. Other dogs arrive all seems good but after small greetings other dogs start growling at my dog... I start to get away my dog follow me and other dog follow my dog...  After maybe 300 meter and some growling other dogs lose interest and leave. I leash my dog and no harm happen. 

What would you guys have done. What if it was two months ago when she didn't have good recall. What if other dogs start escalating.",DogAdvice,dog freely roaming the park,
1669585263,self.DogAdvice,True,"As the title suggests, I am looking to get all my ducks in a row before he comes next month.

My brother informs me the dog cannot have a bed in his crate because he humps, supposedly he marks, and he poos when he's excited??


I think for humping (he says it's dominance but hasn't that been debunked?) getting him more exercise should help right? Right now he gets maybe, and I do mean maybe, a 5 minute walk everyday or every other day.

Marking- he is intact but he is also 8?(we think) I will be speaking to my vet about neutering and if it's safe for his age but what enzyme cleaner would be best to help with marking and to prevent it?

Excited poo- I don't even know where to begin. I was told even if he was outside and pooped, he still does it when he's excited?

I am doing an embark test on him because I feel knowing his breeds might help. Brother states he's a chi/Yorkie but I see a chi/Jack Russel.",DogAdvice,Trying to get advice prior to foster dog arriving: how to stop marking and humping,
1669584159,self.DogAdvice,True,"7 mo GSD, i know some dogs are more chew-wired than others and i know that puppies are tough, but he is literally eating the floor. I take him on two good walks a day and we play in between. At the moment he's low on toys as he's chewed through all but two, but those are still available to him. I also give him a chew stick for short periods of time.   


That being said, whenever there's nothing in his mouth, there's a good chance he'll look for something. He's torn holes in 3 of my blankets, chewed pieces of the wall, destroyed some wooden furniture that was in his room, and as you know, he is eating the floor. What am I supposed to do? I can't possibly entertain him 24/7.",DogAdvice,Dog literally eats the floor,
1669580220,self.DogAdvice,True,"One of My oldest friends wife and kids want a dog. He said no. If I draw him for secret Santa, I’ve gotten his wife’s permission to gift a puppy. These are kind, sweet responsible financially able people. That the entire family is on board is the only reason I would consider this. Wife assured me my open invitation to their home would remain in place no matter what husband says. What’s best way to do this?

It’s important I get something that fits their lifestyle. Do I solicit the kids input (8 and 4)? Just ask wife to do it and send me an invoice?  Tell them to visit a particular rescue and tell the rescue to bill me for all costs?",DogAdvice,Giving the gift of dog…,
1669580014,self.DogAdvice,True,"I bought a new puppy today and introduced him to my older dog (1 year old) and he was so happy and playful the thing is my new puppy was terrified and screaming as soon as he saw my other dog, any advice please on what i can do to get my new puppy to trust my other dog and not be scared of him? Thanks in advance",DogAdvice,Introducing new puppy help,
1669576976,self.DogAdvice,True,"Hi! I was wondering if there’s any advice that could be provided for my spouse and I. We have three dogs that we love dearly but due to our work schedules it can be difficult to walk all three together.

Our dogs are 11, 9 and 2. Our two year old very much has attachment anxieties when she’s felt left out.  She’s a COVID puppy and we’ve been working still on the pack dynamics.

The other thing is our 11 year old can easily walk more than the other two.  His energy requires longer walks than the other two.  Our nine year old has a little bit of arthritis and we’re working to reduce her weight a bit.  But we’re not comfortable pushing her beyond 1.5 miles even though she loves it.

If there’s more information needed I can certainly add it.  Any thoughts on how to manage this would be appreciated!  

If it helps I’m usually up earlier. The two year old and 11 year old get up with me, I let them out for potty break and usually feed them first.",DogAdvice,Dog Walks- We have 3,
1669572917,self.DogAdvice,True,,DogAdvice,Urgent🚨 help needed for this dog 🐕,
1669572306,self.DogAdvice,True,"Hey! So obligatory info about my dog, she’s a 5 month old golden retreiver.

As I was getting ready for a bath she proceeded to sniff my crotch and butt multiple times and then hump the air after each try. As well as humping the air as I stepped into the bath. 

Is there any particular reason for this behavior? 

Currently she’s just sorta staring at me and wandering the bathroom, occasionally making a whimper.",DogAdvice,"Strange puppy behavior, she smelled me and then humped the air???",
1669571662,self.DogAdvice,True,"I’ve heard some scary things about Hartz dog products, like causing death in dogs. I just realized the chews called “oinkies” I’ve been giving my dog are Hartz brand. I’ve given these to my dog before and she’s been fine but after seeing that brand now I’m nervous to give her any more. Do any of you have experience with Hartz? Are their chews safe? Everything I’m finding online about the chews seem alright but I’ve heard stories about their other products.",DogAdvice,Hartz brand?,
1669571252,i.redd.it,True,Hi everyone! I bought my dog a hedgehog with a low squeak. She tore the face off same-day LOL but the squeaker is still good. I’ve been searching for a toy to put the squeaker in and can’t seem to find one. Any recs? Photo of squeaker with my hand for size reference.,DogAdvice,ISO DOG TOY,image
1669569480,self.DogAdvice,True,"We adopted a black lab mix about a month ago. We highly suspect that he has some Boxer and Pitty mixed in there and generally, he’s pretty great.  The only thing is that he has started to become mouthy and we think he does that when he wants attention. This whole month he has not been allowed on the couch despite desperate and basically constant attempts. This mouthing comes immediately after he asks to be on the couch and is told “off” multiple times. Should we just give in and let him on the couch?

We’ve both caved twice each and while he’s on the couch he just snuggles for 20 minutes and then returns to his own bed. At this point it’s exhausting constantly monitoring him and the only way he will stay off long term is if we yell which we hate. If we crate him (about 20 minutes) we only get a 2-5 minute break and then he’s back to wanting on the couch and mouthing when he doesn’t get his way.

So please help! Should we give in? Stay strong? What has been your experience?

[View Poll](https://www.reddit.com/poll/z66rhs)",DogAdvice,Should I let my dog on the couch?,
1669568248,i.redd.it,True,"Hey! Recently became dog parent of a beautiful retired racing greyhound, he is a delight all around. Unfortunately, he is afraid of the stairs.
He was in a foster home before coming home with us and they said they've worked on stairs with him but I'm having a difficult time believing that. 
He's not really treat motivated, we've tried multiple different treats but still nothing. The only thing that's ""worked"" is physically picking his legs up and placing them on each step. We've done this every day since we got him (maybe a week and 1/2) and he still doesn't seem to understand how to go about the stairs on his own. 
He will go down the stairs on his own though. 

Does anyone have any advice or pointers on how to help our lil guy up the stairs?
 
(Yes, we do try to let him figure it out while we have him on the stairs but he just freezes and shakes..he is very nervous.)",DogAdvice,4yr old afraid of stairs,image
1669567117,self.DogAdvice,True,"Hi all, 

I adopted my puppy from a shelter at 6 months old- she was already spayed when we adopted her. Since day 1 we noticed that she was having frequent pee accidents in the house. I suspected a UTI and it turned out to be the case (even though the vet was skeptical, I was adamant that it wasn’t just behavioral). The uti was still there after a week of antibiotics. The vet then suggested to do a month long course of antibiotics, which we are now coming to the end of. 

Now and a few times previously I have noticed that my pup sometimes leaks urine when she’s sleeping.

I am taking her back for a follow up with the vet this week, but she has had a radiograph in the last month to rule out stones. 

I’m wondering if anyone out there has had a similar experience with a pup that was spayed very young? Is it poor muscle tone?

Or has anyone experienced incontinence in dogs who receive calming treats with hemp seed powder? (She takes two of the Zesty paws calming bites daily as recommended by the brand for her weight) I’m considering taking this out of her regiment as an experiment to see if there are any improvements until we actually see the vet. 

Any insight appreciated!",DogAdvice,Urinary incontinence in 8m spayed pup,
1669566541,,False,[deleted],DogAdvice,Urinary incontinence in 8 month old spayed pup,
1669563309,i.redd.it,True,,DogAdvice,What could be causing my dogs poop to look like this.,image
1669562327,self.DogAdvice,True,I live alone and been considering researching adopting a puppy. If I get him young enough would I be able to train him not to bark in our building? As we can’t have constant barking here or else I could get in trouble. If so would it be fairly easy?,DogAdvice,"If I adopt a puppy, would he cause loud noises in our building?",
1669561659,self.DogAdvice,True,"I am getting a bit annoyed now... It's been almost a week already. Lately, my dog now considers me as her favorite in the family and would get excited, follow me everytime I walk around the house and start jumping on my leg and do something strange.

I understand humping for both male and female dogs are to show that they are happy, loving or reducing anxiety, but now it's been done more often. Tasha was never like this before. I honestly forgot how the behavior started but she is like this since 4 days ago. Tasha's nails are also very long and she refuses to have them cut, so it makes the humping even more suffering with her scratching me.

Even if I tried to move my leg to get her off, or command her to not do so, she will come back and do just that. What is another way to get her from humping me everytime I am around?",DogAdvice,"How to get my dog to stop doing ""that"" to my leg? It's a female shih tzu...",
1669560405,self.AskVet,True,,DogAdvice,1 y/o male chocolate lab with chronic ear infections/red splotches on stomach and under arms,
1669558542,self.DogAdvice,True,"i’ve recently moved in with a few roommates, of course i brought my dog.
my roommates also have a dog but theirs has fleas and they have gotten into my dog. 
my dog usually takes advantus and he’s never has fleas until now. 
any suggestions on new flea preventative or remedies?",DogAdvice,Fleas 🚫,
1669542524,i.redd.it,True,,DogAdvice,Help!!!! my dog just ate chocolate. I tried to take it from him but he became aggressive and bit me Our vet is closed.What should i do???,image
1669542189,i.redd.it,True,"Help!!!!
my dog just ate chocolate.
I tried to take it from him but he became aggressive and bit me.
Our vet is closed.What should i do???",DogAdvice,Helppp,image
1669541734,self.DogAdvice,True,"A random thought hit me and I was wondering how dangerous it would be if I were to live with an excessively wet dog that drools as much as they breathe. 

I live with a Doberman as my service dog and the only time I ever see him drool is for very specific treats. 

Out of fear I never hand treats/toys/etc., over when he’s drooling a lot. I just toss it to him and then wash hands thoroughly.",DogAdvice,"Sorry if this is a dumb question, but as an immunocomp should I be careful about handling dogs that excessively drool?",
1669538888,self.DogAdvice,True,"I have sent an image to my vet for their opinion on the matter (image attached to this post) but was wondering in the meantime if anyone has any advice or if the scratch appears particularly concerning? It may have been scratched by our cat although it could also be from rummaging in bushes etc.

It has only happened some time in the second half of yesterday, puppy is acting completely normal and have not noticed any squinting or fluid from the eye.

[https://imgur.com/a/Ey67R1p](https://imgur.com/a/Ey67R1p)",DogAdvice,Puppy scratched eye sclera?,self
1669536886,i.redd.it,True,,DogAdvice,Is the redness normal? What could it mean,image
1669535042,i.redd.it,True,,DogAdvice,Are both these bag carrying positions safe for my dog's spine?,image
1669534518,self.DogAdvice,True,"My last post was really a typical post about separation anxiety or isolation stress, and the automod posted some useful links for advice to follow, so I'll start that asap.

This post is more about some specific advice to manage the situation as I attempt to resolve it.

Basically, the dog barks through the night, I get up, try to settle him back in his crate, which never works, so I end up letting him in the living room to sleep on the sofa. I (try to) sleep on the other sofa, so he's doubly rewarded by getting to sleep on the sofa AND have me there with him.

The alternative, that I've just thought about while I lie awake on the sofa after another night of barely any sleep, is to actually set up a camp bed in the kitchen to see if he will then sleep through the night, and allow the rest of the house (and neighbours) to actually get some sleep.

I'm just wondering what the least-worst option is right now to save the family's sanity - keep letting him in the living room to sleep when he wakes up during the night, or seeing if he'll sleep though with me on a camp bed in the kitchen with him? I'm not sure right now what the exit strategy for either of those options is!

He's probably sleeping though the night without waling up one night in four - so he can do it.

Any thoughts?!",DogAdvice,Isolation Stress - Part Two,
