created_utc,domain,is_robot_indexable,selftext,subreddit,title,post_hint
1668559626,self.DogAdvice,True,"For a bit of context, my mom has my dog while I'm at college but I only live an hour away.

I got a call from her this morning saying he hasn't eaten/drank in about 3 days, he barely moves around, and he's been puking bile. I left work immediately to come down to be with them and we're currently waiting for our vet appointment he has in about an hour and a half.

Does anyone have any ideas what could be going on? I'm so scared right now and it's like it's not even my dog being here with him he seems so sad. 

In case it helps, he does have a few other health problems. We found out about a year ago that he has epilepsy, so he's been on phenobarbital for about a year. He's also had a consistent cough for about 5 years that only goes away with Prednisone, so he's practically been on steroids for 5 years straight.

He's a 7 year old Siberian Husky if this helps at all. Thank you in advance.",DogAdvice,My dog hasn't eaten/drank in 3 days according to my mom.,
1668556531,i.redd.it,True,,DogAdvice,What is this bump on my dogs back?,image
1668555187,self.DogAdvice,True,"Hey guys, so I've been dating this girl for around 4 months and she owns a 7 year old American Akita - About 80kg large dog.

When we put him out the back and shut the screen door, it knight be to vaccum and mop or do something around the house, he sits at the back door instantly and starts whining and crying. 5 mins in, he will start trying to open the door or bite the door and this will just go on until she finally let's him in. He has a nice back yard and a big house to roam freely around. The back door is usually always open so he has access to outside and inside whenever he wants but when we need to get stuff done without tripping over him, we out him out the back and it's usually only for 30 minutes tops.

Because he's so big, when he claws the door he scratches it and damages the mesh sometimes.

The look on his face when he sits at the door is like he's in trouble or we are treating him poorly. 

Is there a way to reverse this being 7 years old?

He's got a  pretty good life and he's never miss treated but the needyness in these times of trying to clean and the damage done to the back door or side door is starring to get to me.

He has toys out the back, a large fluffy bed, grass to run around on. It doesn't seem all that bad for 30 mins?

Any ideas would be great.",DogAdvice,American Akita - separation anxiety?,
1668553397,self.DogAdvice,True,"My pug has never had mucus in his snot but I started noticing it over the past couple of days, as it’s started to get colder. It’s not thick and there’s not very much of it but I do notice it comes out sometimes when he sneezes (it only happens in one nostril). Other than that, he’s acting completely normal. Is this something I should be concerned about?",DogAdvice,Question about Snot,
1668551666,i.redd.it,True,,DogAdvice,Any advice on what to do? I just noticed it and I’m not sure what it is. She whines when touching outside of ear and that’s when I decided to look inside.,image
1668550365,i.redd.it,True,,DogAdvice,What happened to my dogs armpit ???what do I do ?,image
1668548949,self.DogAdvice,True,"Hello!

I just fed my dogs and noticed my Frenchie was shivering after she ate (approx. 5-10 mins afterwards). 

She’s sleeping now but is shivering every 30 seconds or so for about 2 seconds. 

Any suggestions or ideas what it could be? I haven’t found anything chewed around the house (she gets into everything although my house is very clean, she’ll go into the trash in washroom or grab stuff off the table).

Thanks so much.",DogAdvice,Frenchie intermittently shivering out of nowhere.,
1668548563,self.DogAdvice,True,,DogAdvice,I need help stopping my dogs from accidentally cutting themselves,
1668548310,self.DogAdvice,True,"I have a 2 Y/O Boston Terrier who has always drank a lot of water and had frequent (sometimes dark but still yellow) pee. He’s had ear infections, some skin allergies, but nothing serious up to this point. In Feb 2022, the vet tested his blood when I raised my concerns about his thirst/urine. He said the results didn’t indicate anything wrong with his kidney, liver, thyroid, and no diabetes. 

Two days ago, I noticed his pee was DARK and brownish. Took a urine sample to the vet yesterday and they passed it around showing all the techs the dark color ( :( ). This morning, they called me and said to bring him in ASAP for blood work. The vet said blood was present in his urine and his albumin level, supposed to be under 2.5, is 17. WTF!

Basically the anticipation of these blood results is killing me. Aside from his typical ailments he’s had his entire life (thirst/pee), he’s acting TOTALLY normal - energy level, sleep patterns, appearance, appetite, bowel movements, no bad breath.  I understand this could mean kidney or liver failure but would he be acting normal!?  Does anyone have any experience with HIGH ALBUMIN LEVEL in urine? Any information helps ❤️ thanks",DogAdvice,Need some advice &amp; well wishes,
1668546623,i.redd.it,True,,DogAdvice,What breed mix does my dog look like?,image
1668541577,i.redd.it,True,,DogAdvice,My dog has a white/translucent spot in one of his eyes since yesterday. He’s 3 years old. Could this be an ulcer?,image
1668540971,self.DogAdvice,True,"Hi All-

My dog was diagnosed 3 weeks ago with pancreatitis. Initially he had liquid diarrhea on Friday night before vet visit on Monday and it stayed consistent and didn’t get better over the weekend. 

On the Monday he was diagnosed and given a drug (Cerenia) at the vet. I started him on Metronidazole for 7 days and FortiFlora for 10 days. All while on a bland diet. 

I had his 2 week check up and at the vet his blood panel still showed abnormal. Their machine only shows normal or abnormal. So we continued on with the bland diet for another week. X-Ray was negative on anything noticeable. 

Yesterday (week 3) his blood work still showed abnormal but I had them also send his blood out to get a number that could possibly show the severity of it, currently waiting for those results. 

His diarrhea stopped after the cerenia shot though it was still soft and messy just not liquidated.  He doesn’t throw up and seems more active and back to himself over time. The last week or so his poop is decently firm and looks normal. 

The weird this since this all started his gut or pancreas is super loud, like it’s very audible from like 10 feet away. 

Anyone know of what else might be going on or if they had similar timeframe?

He’s a 10.5 year old German pincher male.",DogAdvice,Dog with pancreatitis for 3 weeks now,
1668538982,self.DogAdvice,True,"I have an almost 5 year old corgi and have been strongly considering getting another one next year. The problem is that my dog is very jealous. She gets jealous when my boyfriend and I give each other affection. Either she’ll squeeze her way between us, nudge us until we either tell her to go on her pad or kennel or try to get in on the action with puppy kisses (which is not what you want to listen to or think about as you kiss your partner). She’ll even bark at us when we hug sometimes. We’re working on fixing these problems but progress is slow and I’m not exactly sure how to stop this behavior besides having her go to her pad and only giving her attention when I decide, not when she’s trying to get my attention. 

My boyfriends mom got a puppy recently and she HATES this poor creature. She never hurt it at all or was worryingly aggressive but she completely ignored it and snarled/intimidated/snapped at it when it came to her (and they were not left alone without supervision). The motherly instinct I hope would kick in was no where to be seen. This has obviously made me worry how she will behave with a new puppy around so I was wondering if anyone has navigated a similar situation or has any advice on how to curb this behavior in preparation to getting a puppy. 

I think it might be relevant to mention she was attacked by a small dog when she was a puppy. She’s got a little scar on her nose to prove it and has been wary around smaller dogs ever since. She’s very submissive around large dogs (even having been attacked by an off leash dog on a walk a year ago, although that encounter left no injuries and the dogs were quickly split apart) but gets nervous and more on guard around small ones.",DogAdvice,I’m thinking about getting a puppy next year but I’m worried about my jealous dog,
1668536632,self.DogAdvice,True,"I am weighing the pros and cons. I am also worried that if my dog brings in ticks on their fur, but the tick doesn’t latch to them because of medication, I imagine they would fall off in the house and attach to me instead. Thoughts?",DogAdvice,Does tick medication keep ticks from latching on? Or just prevent disease?,
1668534454,self.DogAdvice,True,"Just brought home a 1-year-old Border Collie mix who recently gave birth and was spayed. She loves people and (most) other dogs. There's one habit we're trying to work on - she jumps up as a greeting.

We're going to engage a trainer shortly but would love to hear anything that worked with your pup. She's about 50 lbs so her jumping could at some point hurt someone (though I don't think she means to). She's REALLY high-energy (which can be a little scary in and of itself). If she jumps on me while I'm standing I'll just calmly walk away and do something else. If she does it while I'm sitting, I can push her off (gently) but I have to keep petting her or she tries it again. She's very demanding about affection, which is sweet ... at first. But I can't type at the computer or look at my phone as she aggressively nudges my arm to pet her again.

I'm torn between wanting to give her lots of pats and attention (because of all she's been through, to reassure her) and thinking I'm maybe encouraging some of her behavior.

I suspect when we start working a trainer and come up with some training ""games"" she'll have a place to put some of that energy. She gets multiple walks during the day (some a mile or so) and we'll be taking her to a local dog run to get some of that energy out as well. But it's sometimes a little scary how needy and demanding she is. My prior dog was terrified of everything when we first adopted him, so all our work was to get him out of his shell. This one has very different needs.",DogAdvice,"New Rescue - Sweet and affectionate but jumps on everyone, even when they're sitting down.",
1668531899,self.DogAdvice,True,Check out this item in my Etsy shop https://www.etsy.com/listing/1333299278/pet-sitter-planner-journal-for-pet,DogAdvice,A should have!,self
1668530195,i.redd.it,True,,DogAdvice,"Picked em off my pup, thoughts? They look different colored, likely to one having more blood",image
1668529392,self.DogAdvice,True,My 13 week old puppy started limping on Saturday and we can’t figure out why. We gave her two days to rest thinking she’d get better but it’s only gotten worse and now she doesn’t want to put any weight on that foot. Where I live there are only three veterinarians within a two hour drive and they’re all booked out for at least two weeks. Am I just supposed to wait two weeks and hope she gets better on her own in the meantime. I don’t know what to do and I don’t want her to be in pain for weeks until she can be seen. I’m also worried it could be the kind of injury that’s no big deal if treated immediately but could leave lifelong damage if we let it go for two weeks before we do anything.,DogAdvice,What do you do when you can’t get a vet appointment?,
1668529071,self.DogAdvice,True,"My dog is a whole mix of breeds (Staffordshire pit, tree walking coonhound, and lab are the main ones). He’s about 1.5 years old and has always been a very good eater. So much so that when he was a pup we used a slow feeder. 

Recently, he had this mass on his foot that got very red and infected. We took him to the vet and they gave us antibiotics and anti inflammatory pills. He hates the pills (they smell like a fart) and we’ve been shoving them down his throat for about a month now after every meal. The mass on his foot is almost gone (just some scabbing/scar tissue left), but for the last couple of days he’s been completely uninterested in his breakfast or dinner. He still takes treats and snacks but just licks all the kibble in his bowl during meals. I have to hand feed him the food because he has to take the pills with food in his stomach. 

So I’m wondering if the reason my dog isn’t eating is because he’s now associated meal time with getting 3 pills shoved down his throat. The pills run out tomorrow morning and the vet doesn’t want to see him unless the bump on his paw comes back. Should I just wait and see if his behavior changes after the pills stop or is this something I should address sooner rather than later?",DogAdvice,Concerned over my dog not wanting to eat…,
1668525039,self.DogAdvice,True,"I was told she was a 2 year old spay, rescue. She was actually passed around on Facebook quite a bit before we got her and the vet I was able to track down stated she was not spayed. Since I’ve hade her (2weeks), she has put on some weight and I am concerned I was given a pregnant dog. Is there anything I can do about holding the previous owners partially responsible financially? I am willing to keep her (she is a dream.) I just am concerned about the health and financial needs. Her appointment is Thursday so I will know for sure then. Just over here worrying. She would initially lick the bowl clean, and eat so fast she would choke, but now she leaves some food in the bowl and doesn’t eat as quickly so I don’t know if she just wasn’t getting adequate food until now (following guidelines on dog food bag for amount). Also she gets healthy snacks like carrots and apples occasionally. So…anyway options, words of wisdom?",DogAdvice,"We adopted a dog from a neighbor who was moving, I was told she was spayed. However, I think they gave me a pregnant dog…",
1668523945,self.DogAdvice,True,"I have a dog whom I absolutely love. She helps me so much everyday with my anxiety. She's a sweetheart. The thing is, I would like to take my Master's abroad. There is this really interesting programme that will last a minimum of 2 and a maximum of 3 years. It's exactly what I want, but I'm terrified of leaving my dog with my parents and then, upon my return, finding out she doesn't really care for me anymore. If I indeed do my Master's abroad, I would make arrangements in order to go home for the entire duration of my vacation (so about 2 and a half months in the Winter and 3 months in the Summer) and I'm also planning on visiting home every 2 and a half months each semester for various reasons. In a way, I think I would still be able to provide my dog a lot of quality time with me, but I spend *a lot* more time with her now. I fear she might forget about me or, at the very least, lose interest in me. Upon my return I intend to find a job in my home country and get a house, to where I'd take my dog so she could live with me and finally be totally reunited. But I fear she won't like me as much by then... What is your opinion on the matter? Thank you.",DogAdvice,Will my dog still like me after being gone for 2 or 3 years?,
1668522247,self.DogAdvice,True,"I have two 7 year old Great Pyrenees, one of them a mix with Border Collie. The latter got out this morning chasing a couple of coyotes that like to hang out here. I am a retired wildlife rehabilitator, so I don't mind it and occasionally chase them off myself to discourage them to come too close to human properties.

But this morning, when I started to panic watching my dog catching up the coyotes, preparing myself for growls and fighting and vet appointments, I couldn't believe my eyes when they started playing like puppies! For solid 5 minutes! 

In all these years working with animals, that's a first. Anyone else had that happen???",DogAdvice,Dog playing with coyotes?,
1668518386,self.DogAdvice,True,"My 1.5 year old Aussie has been going to daycare since she was 4 months old, she recently (about 2 months ago)switched because we found one closer but she’s been doing very well and has never had any problems. Last night my husband said she was fine on the way home but once she got home she was WIRED. She came in barking aggressively, growling at everyone in the house, obviously upset. So I took her upstairs to our room, gave her some relaxing massages and scratches and a lick mat and put her to bed early hoping she would chill out. Well this morning she was growling again and did the stress yawn that dogs do. We had just woken up too, I wasn’t even out of bed. I plan on calling the daycare today but don’t really have high hopes of them giving me any information since nothing was said at pick up last night. 
She’s normally a reactive dog but never has issues at daycare. 
What could it be??",DogAdvice,Came home from daycare stressed,
1668517531,self.DogAdvice,True,"To preface - I’ve had my 4 year old dog for 3 years. She is very sweet and obedient, she has some anxiety around other dogs but we are working on that. 

Last night I heard her in the kitchen, we had left a garbage bag on the floor to take out later. She was sniffing around it, so I told her to “leave it” and to my absolute shock she started snarling and growling at me, I repeated the command and she continued…. It was dark so I turned on the light and she stopped, moved away from the garbage and sat down. After I left the kitchen, she followed and behaved as usual. 

I am quite shaken by this, she has never done anything like this before. Is this something to be concerned about? What next steps should I take?",DogAdvice,"My dog started snarling and growling at me, she has never done this before",
1668517420,self.Dogtraining,True,,DogAdvice,tips to keep my trucker dog calm when I get out of the truck,
1668507127,i.redd.it,False,,DogAdvice,major looks very happy with his new house 🏡 with a terrace [OC],image
1668507060,i.redd.it,False,,DogAdvice,major looks very happy with his new house 🏡 with a terrace [OC],image
1668506471,self.DogAdvice,True,"dog, age 2, neutered, cockapoo

the bands are 3/8” and 9.5mm

will he be fine?",DogAdvice,swallowed a very small dental rubber band,
1668504898,self.DogAdvice,True,,DogAdvice,"hey guys, i have a 5 month old american staffy/bull terrier and she’s been sleeping outside for about a month now. I’m getting really anxious as i think it might be too cold and because of mosquitoes. The coldest it gets at night is 12 degrees and we’re coming into summer. is that too cold?",
1668502218,i.redd.it,True,,DogAdvice,Need help with food portions. Does the adult target weight mean the weight of my dog at maturity? My dog 3 months old and 4kgs currently but will be 10kgs at maturity. Should i be feeding him according to the 10kg column numbers?,image
1668501682,self.DogAdvice,True,,DogAdvice,Adopting a Saint Bernard pitbull puppy. Give me some name ideas! (Not sure if we’re gonna get a boy or girl yet so throw in any names!),
1668493038,self.DogAdvice,True,"I’ve got a 2.5 yo ACD mix who is pretty high strung and having reoccurring bouts of GE/HGE for the last 2 years

For the sake of brevity I’ll leave all the details out but happy to provide any that may be helpful. But every few month we were having episodes of gastroenteritis that would land him at the emergency vet. A recent episode evolved into HGE and then this most recent one just started as HGE

I understand they cause isn’t really known but the vet said with as often as these episodes are happening there has to be some underlying condition. We did all the blood panels - all came back in acceptable ranges. We are now trying a strict diet. Essentially just hydrolized protein food. No treats at all. I have no way to know if it’s working. If he has another episode in a couple of months it’s not. Otherwise it may be. The only other test she has mentioned is a ultrasound to check the thickness of intestinal lining. The only other I can think it maybe running high stress is a contributing factor. He has been on a calming probiotic for quite some time. 

Has anyone been through something similar with other ideas? I would love to hear if anyone has ideas or similar experience

Thanks!",DogAdvice,Anyone familiar with reoccurring HGE?,
1668490364,self.DogAdvice,True,how can i force feed my dog if he is aggressive? when he sees the syringe with wet food and when i am approaching his mouth with my hand he bites me. how can i feed him i am desperate please help,DogAdvice,force feed,
1668489879,i.redd.it,True,,DogAdvice,"what does a foxtail wound typically look/feel like? just noticed my dog has this small red bump, hard to touch on inside of her left back leg and worried that it’s a foxtail entry point. she is not limping or licking at the leg, I just happen to notice it",image
1668488606,self.DogAdvice,True,"Its been five months since my exes family sold or got rid of my dog. I have no information on where she went or what they did with her. Its eating me alive. Its hard for me to be around bigger dogs to not talk about her. And I've been working out the circumstances that occured before and after in therapy and I've been getting night terrors about her being in danger, is it just my imagination or do I just miss her. Like I do miss her like hell. I think about her every day and hope she's somewhere better. But I can't shake this feeling. I am desperate to know she's okay and happy but I have no real way to know anymore. How does one even begin to heal and be okay with that? Be okay with the unknown? He never sent me a photo of her. These were the last photos I got of her from a close family friend of his and it tears me up.",DogAdvice,update: a tough decision,
1668488460,self.DogAdvice,True,"recently my pit has started to shake in the car, not every car ride but often. she has her head pulled down and forward like she's trying to figure out where we are going or something. she used to ride really relaxed and would sit back but now she seems anxious, could this just be her not getting enough exercise? the times it has happened have been when she hasn't been out to play for like a day but im not sure.",DogAdvice,9 yr old pitbull,
1668488278,self.DogAdvice,True,"I’m taking her to the vet again tomorrow so I’m not looking for any kind of diagnosis.  Just wondering if anyone here might have suggestions of what could be happening or anything to ask the vet about.  Yes, I know google exists, but I’m trying to avoid some panic scrolling and vague articles.

Context:
The first time she had blood was a few years ago and the tests showed that she had struvite crystals in her bladder.  We put her on an Rx diet - Royal Canin Urinary SO - which did the trick until we moved and it was difficult to get an Rx from her new vet as her X-rays didn’t show any crystals.
She was fine for a while until a few months ago when she started bleeding again.  We had X-rays and a urinalysis done, but there were neither crystals nor bacteria found.  The vet put her on a round of a general antibiotic -  Clavamox - and everything seemed fine.
That is, until today when she had an accident in the house and there was a considerable amount of blood.

She is about 4.5-5 years old, Pit mix, vaccinated.
TIA!",DogAdvice,My dog intermittently has blood in her urine and idk what it could be.,
1668487858,i.redd.it,True,,DogAdvice,Does anyone know if this is a good ear cleanser for dogs?,image
1668484839,self.DogAdvice,True,"my dog, 11yr male shih-tzu…his name is rudy and he’s my best friend. rudy was not neutered and this caused an excess of testosterone to cause unnatural growth (apocrine gland adenocarcinoma - cancer) to form in place of his anal sacs. his condition is extremely bad, as the tumors have ulcerated all around his anus. undoubtedly causing pain for him. we keep a ‘cone’ on him nearly at all times so that he does not lick his behind. we have bought cheap blankets to cover every surface with so rudy can go on our beds without getting blood everywhere. 

my father didn’t want to go to the vet because he knew how expensive it would be. we went to the vet in 2020 and they told us they would have to do major surgery to his anal region, and there was major chance with rudy’s age at the time already that rudy would lose complete function of his anus and bowel movements. also a nervousness about sending rudy through a major surgery with his heart murmur and his age. this surgery would cost $7,000. my dad refused, and cried on the way home

my dad has a habit of empathizing with rudy, saying “his ass must hurt” and “poor guy”. when i say that we could do something about it, such as start looking around for other vets and second and third opinions- he refuses, saying it will be a waste. it is my impression that he has given up on rudy’s chance of a better life. 

i don’t know what to do. im honestly afraid to go to a vet because they’ll be angry at how far along his condition is. im scared 

for a year i really tried to push the option of gofundme and other donation centers like that. my dad HATES when i bring that up. he wouldn’t accept money from strangers he says. i don’t know my options.",DogAdvice,please give me advice,
1668484039,/r/DogAdvice/comments/yvlxp9/hi_all_does_anyone_know_what_does_behavior_means/,True,,DogAdvice,"Hi all, does anyone know what does behavior means?",hosted:video
1668482881,i.redd.it,False,,DogAdvice,Noticed my dog had a lump on her breast. She’s 17 months. Acting normal. Vet appt is tomorrow but im freaking out.,image
